--bind_port=8848

0 `echo "当前参数：tcp_synack_retries=$(cat /proc/sys/net/ipv4/tcp_synack_retries)"`

+0 socket(AF_INET, SOCK_STREAM, 0) = 3
+0 setsockopt(3, SOL_SOCKET, SO_REUSEADDR, [1], 4) = 0
+0 bind(3, ..., ...) = 0
+0 listen(3, 128) = 0

+.1 < S 0:0(0) win 1000

// 17:37:18.069182 tun0  In  IP 192.0.2.1.54125 > 192.168.1.58.8848: Flags [S], seq 0, win 1000, length 0
//
// 17:37:18.069233 tun0  Out IP 192.168.1.58.8848 > 192.0.2.1.54125: Flags [S.], seq 577559022, ack 1, win 64240, options [mss 1460], length 0
// 17:37:19.218083 tun0  Out IP 192.168.1.58.8848 > 192.0.2.1.54125: Flags [S.], seq 577559022, ack 1, win 64240, options [mss 1460], length 0
// 17:37:21.296783 tun0  Out IP 192.168.1.58.8848 > 192.0.2.1.54125: Flags [S.], seq 577559022, ack 1, win 64240, options [mss 1460], length 0
// 17:37:25.390972 tun0  Out IP 192.168.1.58.8848 > 192.0.2.1.54125: Flags [S.], seq 577559022, ack 1, win 64240, options [mss 1460], length 0
// 17:37:33.473551 tun0  Out IP 192.168.1.58.8848 > 192.0.2.1.54125: Flags [S.], seq 577559022, ack 1, win 64240, options [mss 1460], length 0
// 17:37:49.739480 tun0  Out IP 192.168.1.58.8848 > 192.0.2.1.54125: Flags [S.], seq 577559022, ack 1, win 64240, options [mss 1460], length 0

// 使用脚本计算，重试：1s-2s-4s-8s-16s
// Time difference: 0:00:01.148850
// Time difference: 0:00:02.078700
// Time difference: 0:00:04.094189
// Time difference: 0:00:08.082579
// Time difference: 0:00:16.265929

+0 `sleep 1000000`
